{
  "decision_id": "dec-2026-001",
  "inputs": {
    "customer_id": "CUST-12345",
    "risk_score": 0.82,
    "transaction_amount": 2500
  },
  "metadata": {
    "model_version": "v3.2",
    "system": "fraud-detection-service"
  },
  "outputs": {
    "decision": "approve",
    "reason": "Risk score below rejection threshold"
  },
  "signature": {
    "algorithm": "ed25519",
    "public_key": "s4jBatAxxsy0mQN3ce6dnUXcBGM4OIkgJMLDgWiCyvg=",
    "value": "IEZjlpAH/zffmo9BS0WHW30vJD0S4mMFV/+NR5EAT0QU+1AzwXKeAMfAikx5qrwshd39xNMat5fFiV6XDATZAQ=="
  },
  "timestamp": "2026-03-05T12:00:00Z",
  "version": "1.0"
}